[
  {
    "name": "Barbarian",
    "hit_die": 12,
    "primary_ability": [
      "STR"
    ],
    "saving_throws": [
      "STR",
      "CON"
    ],
    "armor_proficiencies": [
      "Light armor",
      "Medium armor",
      "Shields"
    ],
    "weapon_proficiencies": [
      "Simple weapons",
      "Martial weapons"
    ],
    "skill_choices": [
      "animal_handling",
      "athletics",
      "intimidation",
      "nature",
      "perception",
      "survival"
    ],
    "num_skills": 2,
    "subclass_level": 3,
    "features_by_level": {
      "1": [
        "Rage",
        "Unarmored Defense",
        "Weapon Mastery"
      ],
      "2": [
        "Danger Sense",
        "Reckless Attack"
      ],
      "3": [
        "Barbarian Subclass",
        "Primal Knowledge"
      ],
      "4": [
        "Ability Score Improvement"
      ],
      "5": [
        "Extra Attack",
        "Fast Movement"
      ],
      "6": [
        "Subclass feature"
      ],
      "7": [
        "Feral Instinct",
        "Instinctive Pounce"
      ],
      "8": [
        "Ability Score Improvement"
      ],
      "9": [
        "Brutal Strike"
      ],
      "10": [
        "Subclass feature"
      ],
      "11": [
        "Relentless Rage"
      ],
      "12": [
        "Ability Score Improvement"
      ],
      "13": [
        "Improved Brutal Strike"
      ],
      "14": [
        "Subclass feature"
      ],
      "15": [
        "Persistent Rage"
      ],
      "16": [
        "Ability Score Improvement"
      ],
      "17": [
        "Improved Brutal Strike"
      ],
      "18": [
        "Indomitable Might"
      ],
      "19": [
        "Epic Boon"
      ],
      "20": [
        "Primal Champion"
      ]
    }
  },
  {
    "name": "Bard",
    "hit_die": 8,
    "primary_ability": [
      "CHA"
    ],
    "saving_throws": [
      "DEX",
      "CHA"
    ],
    "armor_proficiencies": [
      "Light armor"
    ],
    "weapon_proficiencies": [
      "Simple weapons"
    ],
    "tool_proficiencies": [
      "Musical Instrument",
      "Musical Instrument",
      "Musical Instrument"
    ],
    "skill_choices": [
      "acrobatics",
      "animal_handling",
      "arcana",
      "athletics",
      "deception",
      "history",
      "insight",
      "intimidation",
      "investigation",
      "medicine",
      "nature",
      "perception",
      "performance",
      "persuasion",
      "religion",
      "sleight_of_hand",
      "stealth",
      "survival"
    ],
    "num_skills": 3,
    "subclass_level": 3,
    "spellcasting_ability": "CHA",
    "features_by_level": {
      "1": [
        "Bardic Inspiration",
        "Spellcasting"
      ],
      "2": [
        "Expertise",
        "Jack of All Trades"
      ],
      "3": [
        "Bard Subclass"
      ],
      "4": [
        "Ability Score Improvement"
      ],
      "5": [
        "Font of Inspiration"
      ],
      "6": [
        "Subclass feature"
      ],
      "7": [
        "Countercharm"
      ],
      "8": [
        "Ability Score Improvement"
      ],
      "9": [
        "Expertise"
      ],
      "10": [
        "Magical Secrets"
      ],
      "12": [
        "Ability Score Improvement"
      ],
      "14": [
        "Subclass feature"
      ],
      "16": [
        "Ability Score Improvement"
      ],
      "18": [
        "Superior Inspiration"
      ],
      "19": [
        "Epic Boon"
      ],
      "20": [
        "Words of Creation"
      ]
    }
  },
  {
    "name": "Cleric",
    "hit_die": 8,
    "primary_ability": [
      "WIS"
    ],
    "saving_throws": [
      "WIS",
      "CHA"
    ],
    "armor_proficiencies": [
      "Light armor",
      "Medium armor",
      "Shields"
    ],
    "weapon_proficiencies": [
      "Simple weapons"
    ],
    "skill_choices": [
      "history",
      "insight",
      "medicine",
      "persuasion",
      "religion"
    ],
    "num_skills": 2,
    "spellcasting_ability": "WIS",
    "subclass_level": 3,
    "features_by_level": {
      "1": [
        "Spellcasting",
        "Divine Order"
      ],
      "2": [
        "Channel Divinity"
      ],
      "3": [
        "Cleric Subclass"
      ],
      "4": [
        "Ability Score Improvement"
      ],
      "5": [
        "Sear Undead"
      ],
      "6": [
        "Subclass feature"
      ],
      "7": [
        "Blessed Strikes"
      ],
      "8": [
        "Ability Score Improvement"
      ],
      "10": [
        "Divine Intervention"
      ],
      "12": [
        "Ability Score Improvement"
      ],
      "14": [
        "Improved Blessed Strikes"
      ],
      "16": [
        "Ability Score Improvement"
      ],
      "17": [
        "Subclass feature"
      ],
      "19": [
        "Epic Boon"
      ],
      "20": [
        "Greater Divine Intervention"
      ]
    }
  },
  {
    "name": "Druid",
    "hit_die": 8,
    "primary_ability": [
      "WIS"
    ],
    "saving_throws": [
      "INT",
      "WIS"
    ],
    "armor_proficiencies": [
      "Light armor",
      "Shields"
    ],
    "weapon_proficiencies": [
      "Simple weapons"
    ],
    "tool_proficiencies": [
      "Herbalism Kit"
    ],
    "skill_choices": [
      "animal_handling",
      "arcana",
      "insight",
      "medicine",
      "nature",
      "perception",
      "religion",
      "survival"
    ],
    "num_skills": 2,
    "spellcasting_ability": "WIS",
    "subclass_level": 3,
    "features_by_level": {
      "1": [
        "Spellcasting",
        "Druidic",
        "Primal Order"
      ],
      "2": [
        "Wild Shape",
        "Wild Companion"
      ],
      "3": [
        "Druid Subclass"
      ],
      "4": [
        "Ability Score Improvement"
      ],
      "5": [
        "Wild Resurgence"
      ],
      "6": [
        "Subclass feature"
      ],
      "7": [
        "Elemental Fury"
      ],
      "8": [
        "Ability Score Improvement"
      ],
      "10": [
        "Subclass feature"
      ],
      "12": [
        "Ability Score Improvement"
      ],
      "14": [
        "Subclass feature"
      ],
      "15": [
        "Improved Elemental Fury"
      ],
      "16": [
        "Ability Score Improvement"
      ],
      "18": [
        "Beast Spells"
      ],
      "19": [
        "Epic Boon"
      ],
      "20": [
        "Archdruid"
      ]
    }
  },
  {
    "name": "Fighter",
    "hit_die": 10,
    "primary_ability": [
      "STR",
      "DEX"
    ],
    "saving_throws": [
      "STR",
      "CON"
    ],
    "armor_proficiencies": [
      "Light",
      "Medium",
      "Heavy",
      "Shields"
    ],
    "weapon_proficiencies": [
      "Simple weapons",
      "Martial weapons"
    ],
    "skill_choices": [
      "acrobatics",
      "animal_handling",
      "athletics",
      "history",
      "insight",
      "intimidation",
      "persuasion",
      "perception",
      "survival"
    ],
    "num_skills": 2,
    "subclass_level": 3,
    "features_by_level": {
      "1": [
        "Fighting Style",
        "Second Wind",
        "Weapon Mastery"
      ],
      "2": [
        "Action Surge (one use)",
        "Tactical Mind"
      ],
      "3": [
        "Fighter Subclass"
      ],
      "4": [
        "Ability Score Improvement"
      ],
      "5": [
        "Extra Attack",
        "Tactical Shift"
      ],
      "6": [
        "Ability Score Improvement"
      ],
      "7": [
        "Subclass feature"
      ],
      "8": [
        "Ability Score Improvement"
      ],
      "9": [
        "Indomitable (one use)",
        "Tactical Master"
      ],
      "10": [
        "Subclass feature"
      ],
      "11": [
        "Two Extra Attacks"
      ],
      "12": [
        "Ability Score Improvement"
      ],
      "13": [
        "Indomitable (two uses)",
        "Studied Attacks"
      ],
      "14": [
        "Ability Score Improvement"
      ],
      "15": [
        "Subclass feature"
      ],
      "16": [
        "Ability Score Improvement"
      ],
      "17": [
        "Action Surge (two uses)",
        "Indomitable (three uses)"
      ],
      "18": [
        "Subclass feature"
      ],
      "19": [
        "Epic Boon"
      ],
      "20": [
        "Three Extra Attacks"
      ]
    }
  },
  {
    "name": "Monk",
    "hit_die": 8,
    "primary_ability": [
      "DEX",
      "WIS"
    ],
    "saving_throws": [
      "STR",
      "DEX"
    ],
    "armor_proficiencies": [],
    "weapon_proficiencies": [
      "Simple weapons",
      "Martial weapons with the Light property"
    ],
    "tool_proficiencies": [
      "Artisan's Tools (one type)",
      "Musical Instrument (one type)"
    ],
    "skill_choices": [
      "acrobatics",
      "athletics",
      "history",
      "insight",
      "religion",
      "stealth"
    ],
    "num_skills": 2,
    "subclass_level": 3,
    "features_by_level": {
      "1": [
        "Martial Arts",
        "Unarmored Defense"
      ],
      "2": [
        "Monk's Focus",
        "Unarmored Movement",
        "Uncanny Metabolism"
      ],
      "3": [
        "Deflect Attacks",
        "Monk Subclass"
      ],
      "4": [
        "Ability Score Improvement",
        "Slow Fall"
      ],
      "5": [
        "Extra Attack",
        "Stunning Strike"
      ],
      "6": [
        "Empowered Strikes",
        "Subclass feature"
      ],
      "7": [
        "Evasion"
      ],
      "8": [
        "Ability Score Improvement"
      ],
      "9": [
        "Acrobatic Movement"
      ],
      "10": [
        "Heightened Focus",
        "Self-Restoration"
      ],
      "11": [
        "Subclass feature"
      ],
      "12": [
        "Ability Score Improvement"
      ],
      "13": [
        "Deflect Energy"
      ],
      "14": [
        "Disciplined Survivor"
      ],
      "15": [
        "Perfect Focus"
      ],
      "16": [
        "Ability Score Improvement"
      ],
      "17": [
        "Subclass feature"
      ],
      "18": [
        "Superior Defense"
      ],
      "19": [
        "Epic Boon"
      ],
      "20": [